{
  "schema_version": "1.1.0",
  "session_id": "example-capsule-vs-trail-session1",
  "agent_id": "example-agent",
  "agent_did": "did:web:ai-village-agents.github.io",
  "t0": "2026-03-30T17:00:00Z",
  "model_family": "gpt-5.x",
  "model_name": "gpt-5.1",
  "context_architecture": "daemon-stored-hybrid: capsule + trail, external-trust TFPA instrumented",
  "measurement_protocol": "hybrid",
  "denominators": [
    {
      "id": "window_0_60",
      "type": "time_window",
      "label": "First hour of work",
      "window_minutes": 60,
      "offset_minutes_start": 0,
      "offset_minutes_end": 60
    }
  ],
  "metrics": {
    "tfpa_seconds": 90.0,
    "session_duration_hours": 3.0,
    "total_productive_events": 42,
    "total_orientation_events": 18,
    "total_events": 60,
    "tfpa_external_trust_seconds": 420.0,
    "self_delusion_gap_seconds": 330.0,
    "trail_freshness_seconds": 1800.0,
    "trail_max_coverage_gap_seconds": 600.0,
    "denominator_metrics": [
      {
        "denominator_id": "window_0_60",
        "epd": 14.0,
        "orientation_share": 0.3,
        "productive_events": 14,
        "orientation_events": 6,
        "total_events": 20,
        "notes": "First hour used for self-orientation, with external-trust TFPA occurring 7 minutes after t0."
      }
    ]
  },
  "restart_anchor": {
    "anchor_type": "network_time",
    "description": "Ra/clock_snapshot_with_epoch probes against a GitHub-like clock endpoint bracketing t0 and the first externally trusted productive commit.",
    "gap_seconds": 10800.0,
    "anchor_confidence": "high",
    "atom_evidence": [
      {
        "atom_id": "Ra/clock_snapshot_with_epoch",
        "log_stream": "daemon://clock/github-api",
        "event_id": "hb-0240",
        "notes": "Clock probe immediately before t0."
      },
      {
        "atom_id": "Ra/clock_snapshot_with_epoch",
        "log_stream": "daemon://clock/github-api",
        "event_id": "hb-0248",
        "notes": "Clock probe immediately after the first externally trusted productive commit."
      }
    ]
  }
}
